filename,duration,transcription
bellingcat-tool/amazonfinds/media/7300142953958313222.mp4,15," If you see us in the club, we're reacting real nice. If you see us on the floor, we're gonna get it watching all night. If you can't hear us, we're combined. If you can't hear us, we're combined. We're gonna see you up to fight."
bellingcat-tool/amazonfinds/media/6855733652974750981.mp4,59," Random thinks I got a famous on part 27. I have a problem first is this laptop desk stand. Wow I can't say that but yeah It makes your laptop up higher and yeah This came up on my youtube recommended not complaining this is an alarm clock that i'm obsessed with mine's actually from target But you can get the same thing like on amazon But it projects the time onto your ceiling so you can just look up and there's the time and it also charges your phone Which is a great plus this really comfy gray jacket and guys it was 750 like so comfortable and so affordable I also got my new favorite tank top ever. It's so comfy and it just fits so perfectly I can't even describe it just obsessed with it This one is for my clean germ disliking people So basically it's a sleeping bag that you put on your bed and your hotel room and then you can just sleep in it And not sleep on the hotel sheets and it even has a spot for your pillow to go in I get the worst canker sores all the time and also from anxiety. I bite the side of my cheek So my mouth is just constantly destroyed. So I like this mouthwash. It really helps the pain This phone case is for my dad Which is why I didn't have the right phone to model it but it's really cool because it gives you a way to stand your Phone up and it does a lot of things this box is the smartest thing ever and it actually came in a packet, too Which I didn't realize but yeah, it makes your cords look so much better You just put them on there as a slot so the cord came out either side and here's the before and after okay. Bye"
bellingcat-tool/amazonfinds/media/7144832760090217771.mp4,60," You are my sunshine, my only sunshine You make me happy when skies are gray You'll never know dear, how much I love you Please don't take my sunshine away The other night dear, as I lay sleeping I dreamed I held you in my arms When I awoke dear, I was mistaken So I hung my head and cried You are my sunshine, my only sunshine"
bellingcat-tool/amazonfinds/media/7220120602919718150.mp4,23," Pushing products to their limit part 7. This device lets you press any switch from your phone, but can it remotely flush a toilet? I started out testing it on my normal light switches and it succeeded as expected. I decided to get creative and try it on my PS4 and it still worked perfectly fine. The final test was to see if it could flush my toilet as my flatmate's always getting angry at me for forgetting. I triggered it from the comfort of my desk and this was the result. A solid effort if you ask me."
bellingcat-tool/amazonfinds/media/7242467229877538090.mp4,60," I bought a new chair. Good news, bad news, good news. I got another chair. The one with the boob supports. Big fan, big fan. Totally worth it. Bad news, I was influenced by my own damn self and by the people in my comments. I didn't need this. I was perfectly happy with the other one. But this one is, it's this, ugh. I was influenced by everyone and myself and I didn't know that was a thing. I just shouldn't have adult money because I buy, I have an impulse control. I just buy shit. I'm not mad I bought it, but I bought it. And I did put the link in my profile, so just go look on my page and you can find the link to this exact chair. Pippin, stop barking."
bellingcat-tool/amazonfinds/media/7009694825083686149.mp4,13, This water bottle made her famous in kindergarten. It turns into a freaking heart and has a secret compartment to hide snacks.
bellingcat-tool/amazonfinds/media/6945875557837999366.mp4,11, Amazon Project Pneu Part 69 of 100. This is a firework light bulb. This thing is absolutely beautiful.
bellingcat-tool/amazonfinds/media/7246847828780223790.mp4,19, Oh no. What the heck? That's a strong onion. Whew. Pfft. Pfft.
bellingcat-tool/amazonfinds/media/7184636305706470702.mp4,6," That's right, fingers through her head, he tryna call her or whatever, she like, fuck that nigga"
bellingcat-tool/amazonfinds/media/6953730314296364294.mp4,12," She goin' ham on my, she goin' ham on my, she goin' ham on my dick tonight She not with him tonight, she not with Jim tonight She in the gym tonight, workout in my pussy, ay"
bellingcat-tool/amazonfinds/media/7329453343493999904.mp4,64," The house just arrived. Let it fall. Pfft. Pfft. Pfft. Oh freaking whale. Yo, it's legit. It's like a rectangle. Looks kinda small. Yo. Oh my gosh. Oh, it's loud in here. It's pretty nice. What's the point of windows? Can't even see outside. What do the windows do? Oh, some bathroom. There's a whole bathroom. And a shower. Wait, there's a shower in there? And a toilet. Bro, you can poop and shower at the same time. Wait, wait, wait. It's kinda tight. Okay, fine. We'll untie it, you know? Oh. Oh. That's crazy. This is kinda nice. It's just like kinda small. What's up with all this? Wait a second, wait a second. Is this like half built? It folds. Did it fold? It folds. Bro, I'm gonna call this place the Hot Pocket because all the goodies are inside and we're the goodies. Oh, that's cool. That's what my laptop does. Yo, the entire house has to fold out. Kinda like a puzzle. Uh So much more room for activities. Yeah. Yeah. Yeah. Yeah. Yeah. Yeah. Yeah. Yeah. Yeah. Yo, this is huge. There's so much room. Where's that wall go? It's the bathroom. Oh. Yeah. That's it? That's it. That's wild. It didn't come with instructions and we built it. Dude, five star review. We just built a house from Amazon. I was kind of worried that we were going to get scammed buying this thing because it had zero reviews. Are we the only person that has actually bought this off Amazon? I think so. They even tape the keys to the house to the door handle. It works. What even is this? You sure we don't need instructions? Dude, I think if like the toilet gets clogged, that's what you use it for. I claim left wing. I got right quadrant. I got the middle. So not only did we buy a house on Amazon, we bought everything you could possibly need to live. This is a lot of boxes. Yeah, we should probably start opening these. We're going to see if it's possible to fully live your entire life off only Amazon."
bellingcat-tool/amazonfinds/media/7187154482914938155.mp4,30," Amazon Kitchen Hacks. This is my Splaatopus that is specifically designed to be cute, but also angled and rounded enough to effectively get the most out of all your jars. No way! This is my clip-on strainer that is probably one of my top five products of all time. Easy to use, easy to store, easy to clean, and it's just simply amazing. Amazing! These measuring spoons comes with built-in levelers so you can easily get the exact amount of ingredients, and this handheld juicer is great when you want to make the most out of your fruit and maximize the juiciness. Juiciness?"
bellingcat-tool/amazonfinds/media/7227470057931033883.mp4,101," memory blitz What you gonna do with your life? Oh Daddy, do you know you're still number one? But girl, say what I have fun Oh girl, just you wanna have That lonely little one That's all But the world can't stay in touch Oh girl, say what I have fun Oh girl, just you wanna have Oh girl, wanna have fun girl Wanna have Someones gay, a beautiful girl And tired of her wet clothes I wish I was the girl I wanna be the one you won't get that time Oh girl, say what I have fun Oh girl, just you wanna have That lonely little one That's all But the world can't stay in touch Oh girl, say what I have fun Oh girl, just you wanna have Oh girl, wanna have"
bellingcat-tool/amazonfinds/media/6863855219550309638.mp4,59," Five bathroom items you didn't know you needed, part two. First up is this waterproof speaker that suctions to the wall of your shower so that you can listen to music while you're in the shower or bath. You can control the volume of the music of the next or previous song, and you can also take a phone call and talk through the speaker. Next are these bottle holders that you can use for shampoo, conditioner, or body wash. They're adhesive so they just stick onto the shower wall and are super easy to assemble, and they just help to eliminate clutter and save space in your shower. If you have limited counter space in your bathroom, this is perfect. It's a mat that just unfolds and you put it over your sink, and it instantly adds additional counter space that you can use to get ready and put your makeup, hair, and beauty products on. If you live in a house full of girls or just lose a lot of hair yourself, this is a must. It's a drain catcher that replaces your normal drain. It's super easy to switch out, and it will catch all of your hair so that your drain won't get clogged. And lastly is this wall outlet shelf that again is really easy to install, and it's nice for things that maybe you don't want on your counter. It frees up a little bit of space for things like your toothbrush or a speaker or a Google Home."
bellingcat-tool/amazonfinds/media/6906488550326291714.mp4,26," This is a time-locking safe container that's perfect for anyone who wants to break a habit. To use it, you set the time by twisting the dial on top before pressing it in. You then have five seconds to cancel before these side tabs come out and the container is locked for the time you set. You can set the timer for up to 10 days and once it's locked there's literally no way to override it without smashing it to bits. It's great for breaking habits like watching too much TV, eating too much chocolate or spending way too much money on Amazon like I do."
bellingcat-tool/amazonfinds/media/6925625460592364805.mp4,23," Before I started painting my floors and had hundreds of people on TikTok telling me I wouldn't be able to sell my house and that I ruined my floors. I cleaned my floors with this fabulous Amazon Find. Swiffer wipes are way too expensive, these reusable Swiffer covers are only $8 for two link in bio?"
bellingcat-tool/amazonfinds/media/7185582567419088171.mp4,58, Squelch Corona sizzling soundmmm A do ba do ba do... that.
bellingcat-tool/amazonfinds/media/6851045401882021125.mp4,16," Stuff you actually need part 21. I've been seeing ads everywhere for these toothbrushes that have 10,000 bristles. So I just had to try them out. I found these off Amazon and they come in a pack of four. So I'm gonna go try them for the first time. Wow, this is so amazing."
bellingcat-tool/amazonfinds/media/7186841991781633326.mp4,5," Can I give you a big hug? No, thanks."
bellingcat-tool/amazonfinds/media/7275070115371175198.mp4,6, The money that complicit from a cycling car is a Sheep as a
bellingcat-tool/amazonfinds/media/7144085158910758190.mp4,40," Favorite products for moms starting with these silicone artist mats. We've been using these artist mats for over a year and a half for all of our arts and crafts projects. Cleanups are super easy with just wiping away or you can run it under water and use dish soap for tougher stains. Simply roll up in store for next time. Next are my famous doorbell chimes. This requires no drills. Instead of yelling for my girls, I just push the bell to get their attention. If you're always finding treasures under your couch, you need these toy blockers. And for those of you who have carpet, a lot of you suggested flipping it upside down and sticking it to the bottom of your couch. And last is a set of picture frames. Open the frame to store all of the artwork your kids bring home from school. Which one of these products did you find most helpful?"
bellingcat-tool/amazonfinds/media/6875729131401661702.mp4,59," Alright, you guys wanted to see how well it cleaned. Here's some oatmeal, some blue cheese, some Catalina dressing. I used one capful of their cleaning solution that comes with the vacuum. Alright, so trying with the original iFloor, which I got from Amazon for $169. And I am so sorry that this camera angle stinks. I didn't realize when I was video recording it, but it does pick up all of that debris after five passes. Here's the iFloor 3, which is $299 on Amazon, and it is currently in stock. Five passes with that, and look at that. It saves so much time vacuuming and mopping at the same time. Alright, so let's check out this bad boy. This is their newest. It is the S3. It pretty much is the same as the iFloor 3. However, it is their smart version, so it talks to you. You can use their app, and it has a couple more sensors. But look at how all three got that floor sparkling clean. My favorite part, self-cleaning. Alright, for the iFloor, you're going to hold down the on-off for 10 seconds. The other two must be on their charging stations, but then you're just going to press that button. Alright, so here we go. And for the results, part two."
bellingcat-tool/amazonfinds/media/6953814809339120901.mp4,13," Pray, get your money, bang, like no other. I'm hopeful, yes I am, hopeful for today. Take this music and use it. Let it take you away and be hopeful, hopeful."
bellingcat-tool/amazonfinds/media/7252527731747966251.mp4,31," If your refrigerator does not have an ice maker, then I have an Amazon must-have for you. I hate these ice trays where it's so complicated to get the ice out and then I even need a ziploc bag to put the ice in. So I found this new product and it's literally my favorite. It comes in tons of cute colors. I have the green but I'm also gonna be getting the white. All you do is fill the ice up, let it freeze, and then you press that button at the top and all of the ice cubes fall out into a tub. I love how it has the tub. It even comes with a scooper so you can scoop the ice out and then you just put that in the fridge and you're good to go. It's super convenient, easy, and affordable. I'm gonna have it linked in my bio."
bellingcat-tool/amazonfinds/media/7259050310155439387.mp4,49, I'll see you next time.
bellingcat-tool/amazonfinds/media/6846561002188754181.mp4,14, Amazon products you need in your life part 14. So this is a regular water bottle right? It has an auto seal lid that you release to automatically seal. It has a carabiner to attach to backpacks and gym bags. But what makes this one different is this.
bellingcat-tool/amazonfinds/media/6920256936977960198.mp4,24," Hello, what the heck is up, welcome to my Amazon workout favorites. These Lulu sports bra dupes are so nice Literally comes with a pack of two for like 22 bucks. This top I just love I don't know if it's a dupe of anything. This one is a Lulu dupe of I don't know what the top is called But I absolutely love it. Moving on to my leggings These are my favorite Align dupes. They're the softest and feel exactly like Aligns Besides the seam in the front and then these are more of a tighter fit I'd call them more of a running legging and they have pockets. They're colorful koala These are also colorful koala Align dupes, but the texture is a little bit silkier These are my favorite sets this one. I like because the length of the biker shorts isn't too long This is definitely a longer biker short, but the color is perfect. Yes, everything I'm wearing is squat proof this one I'm obsessed with I feel like such a cool gym person and this isn't a step But these biker shorts are perfect Lulu dupes links in my bio click Amazon them workout clothes"
bellingcat-tool/amazonfinds/media/7243060925270445314.mp4,22," There once was a ship that put to sea, the name of the ship was the Bully of Tea. The winds blew up, her bow dipped down, oh below my bully boys blow. Soon may the Willa Man come to bring us sugar and tea and rum. One day when the timing is done, we'll take a leave and go. She'd not been two weeks from shore when down on the-"
bellingcat-tool/amazonfinds/media/6954839993852464389.mp4,30," I want to say that for the first time, the fact that I have this have not been able to do it for the most part, but the things that my pippie asked me to do And these shirts are really amazing, it's really expensive because I'm so excited They are very expensive, they are very difficult And look, the things that I asked for are the things that are for the most part These are the ones that I'm not sure I'm going to be able to do it It's like the appropriate one, but for the most part, it's really expensive I'm also going to have to wait for them because they are not in my house Because they have an extension here, if they ask me to do it In the name of the specific"
bellingcat-tool/amazonfinds/media/7136335815726189830.mp4,28," I love this song, Velcro by Velcro. And I have this part here. And you can play it. A big Velcro one or the other. You can play it in one or the other. There's a new one. And then there's another one. And it's super cool. And magical. Loomis. Loomis Maxima. Knox."
bellingcat-tool/amazonfinds/media/7179681186007108870.mp4,17, I wish I knew about this thing earlier. You won't believe but this product made my shower drain smell like lemons. I was trying to get rid of the smell I had in my shower and this helped.
bellingcat-tool/amazonfinds/media/7252372071269797162.mp4,39,b
bellingcat-tool/amazonfinds/media/6940835502119472390.mp4,19, why is there a ton of amazon furniture for 12 cents? first i found this while i was looking for- um okay let's see is this really 12 cents? okay i have to buy this now hopefully they're not like miniature size or something when they come i'll have to duet this when i come
bellingcat-tool/amazonfinds/media/6950048141672516869.mp4,12, Amazon parts you need part 81 of 100. This is a prank blood mat When water falls on the mat and makes it look like blood Thing works so well and is a perfect prank
bellingcat-tool/amazonfinds/media/6987410034145660165.mp4,22,...
bellingcat-tool/amazonfinds/media/7086458772054428974.mp4,56, I'll see you guys in the next video.
bellingcat-tool/amazonfinds/media/7253567273472970030.mp4,66, Thanks for watching.
bellingcat-tool/amazonfinds/media/7143969573719592235.mp4,22," Next word. Let's check it out. This is a trick I've been puzzled by for years. How does a sword pass through a stick without cutting it? Today, I finally found the principle behind it. Check out this snow plate taken by a speed camera. Now do you know why?"
bellingcat-tool/amazonfinds/media/7040954926188481839.mp4,30," With a piece of paper, Amazon promised to sell it for $100. My paper is ready, it is processed and it's ready to be sold at $100. So let's try it, I don't need to worry about it. Ok, the paper that you see, I think it's super ready for the back part, because it's more than $100. Let's try it. Let's try it."
bellingcat-tool/amazonfinds/media/7165677454726597931.mp4,30," This love is good, this love is bad, this love is alive, I've found it at all These hands had to let it go free and this love came back to me Oh, this love, this love left a permanent mark This love is blowing in the dark Oh, this love, these hands had to let it go free And this love, this love came back to me Oh, this love, oh"
bellingcat-tool/amazonfinds/media/7109240518873419054.mp4,14," Random Amazon finds it just slack. This gadget lets you neatly organize your spices, vitamins, or medicine bottles and makes the most out of vertical space in your cabinets. Each side easily pulls out and rotates to give you instant access to the bottles and jars you need and the best part is there's no assembly required."
bellingcat-tool/amazonfinds/media/7332196189649079594.mp4,19," Amazon bathroom finds you actually need. This is a razor which I think is the closest thing you can get to a lawnmower for shaving everywhere in your head. The design is so genius because it's fun but it also allows you to get everywhere with one hand and one grip. You can go real speedy if you want or just take it easy and replacement razors for this are actually easy to get. Okay, thanks for watching. Love you. Bye"
bellingcat-tool/amazonfinds/media/6867333499460898053.mp4,44," College Must Have from Amazon. I wish I would have had one of these in college. They are seriously awesome. It's a wireless digital highlighter and scanner for your notes and textbook. You just glide it over the sentence or paragraph that you're needing to know, and it will automatically transfer it to your computer and read it aloud for you. You also have the option of having it go to your smartphone or tablet. It works for your handwritten notes too, which is awesome. So you just do the same thing, glide it over, and it will scan it onto your computer. You can switch up the different settings depending on what you're scanning, whether it's a text, image, number, or barcode. You can also translate any sentence into 40 different languages. So for that, it's the same thing, glide it over the sentence, and it will automatically translate it and read it aloud in that language that you chose. This is honestly so helpful for college students, and it can save you so much time."
bellingcat-tool/amazonfinds/media/7335266106581503238.mp4,0, Music
bellingcat-tool/amazonfinds/media/7207654608326462763.mp4,24," 5 Amazon finds that just slap. These portable lights that are magnetic, rechargeable, have motion sensors, and can be used as a flashlight so you're not afraid of the dark. This adjustable stand that works with any phone or tablet to watch your fav shows and perfect for travel. This lint roller ball that's washable and reusable so you can take it with you anywhere. These disposable hair catchers for flat shower drains that last up to 3 weeks. And these stylish hooks that don't slide around and makes it easy to grab your towel right after your shower."
bellingcat-tool/amazonfinds/media/7231254478421282074.mp4,71," 10 useful Amazon products I've bought this year. This is a seat gap filler for your car, which slides over your seat belt and stops things from falling down the gap. This is an electric lighter which allows you to light candles without burning your thumb. It uses no gas or fuel and it's rechargeable, meaning it lasts forever and you won't have to keep buying new lighters. This is a thin ice tray which makes ice cubes that can fit into any size bottle, allowing you to keep your drink cold wherever you are. You can even use them in your beer. This is a thermal printer which allows you to print things without using any ink. It uses thermal technology to print on the special paper, saving you money in the long run. These are silicone stretch lids which turn any dish into a Tupperware container. Just stretch them over your food and they keep your food fresher for longer. This is a push whisk which allows you to mix things together by just pushing up and down. This is a mattress gap filler which stops your pillows from sinking down the gap. It makes your bed look more aesthetic and gives you a more comfortable sleep. This is a garlic crusher which crushes garlic super easily and has a built-in wiper blade to remove the excess. This is a handheld vacuum which sucks and blows to clean small messes around the house, on your desk and even in your car. This product can hold your toothbrush on the mirror, keys by the door, raise it in the shower, pen on the fridge and can even stop your charging cable from falling behind your desk."
bellingcat-tool/amazonfinds/media/6831230248789544197.mp4,59," Life-changing kitchen gadgets part 3. I'm gonna be using this corn stripper all summer long. It's so cool you just put the corn in there and twist the tool down and it just strips the corn right off the cob. It's perfect for summer salads and barbecues. This veggie chopper can save so much time you just put the veggie in there push down and it chops it into little pieces. Works great on other things like bell peppers, onions, so many other vegetables and it also comes with different attachments and blades as well. I love these silicone ice trays they come in a pack of two and they're nice and flexible and I think they're just easier to get the ice out than regular ice trays and they're just the perfect shape cube for summer drinks. And lastly these sandwich cutter and sealers are awesome if you have kids who don't like to eat the crust of sandwiches. You just put a cutter down on the sandwich and it cuts off all the crust around the edge and then also comes with a sealer that you push down and it seals up the edges and it's like your own at-home Uncrustable."
bellingcat-tool/amazonfinds/media/7239421445288234283.mp4,37," Okay, I'm like freaking out. I literally think I just found like the best thing to exist on Amazon. You can literally get 54 lip liners, like look at all these colors, this is like nuts, for $27 which means like they're literally 50 cents a piece. I had to think about that for a sec. But like you literally can get a Charlotte Tilbury lip liner for $23 or $26 like for a single lip liner and their reviews are so good like I literally read them because I'm like should I get it, should I not get it, but yeah I just bought it and just wait. Like you're literally kidding me with these colors. They have the prettiest brown shades like tans, nudes, pinks, purple, red, like I probably will never have to buy another lip liner ever again."
bellingcat-tool/amazonfinds/media/7180116160258657582.mp4,14, Watch me apply lashes with this too.
