filename,duration,transcription
bellingcat-tool/amazonfinds/media/7370060678251679022.mp4,91," Babe, hot girl cardinal rule number one, the uglier you go to bed, the hotter you'll wake up. Let me show you how I do it. First things first, moisturizer. Your skin literally gets so dry when you sleep. Super important to overcompensate for that. And moisturize so that you're not producing excess oils. Then I will take some Aquaphor and slug my skin. I swear by this step. You're just gonna take about a pea-sized amount and then rub it all over your face. It's been an absolute game changer in my skin's overall appearance. Another key skin part, my Gua Sha. Literally live, laugh, love my Gua Sha. She's an icon. I love her. Then one of my favorite parts is definitely my heatless curls. Literally a game changer. It saves you so much time in the morning. You're gonna place the rod right in the center. Take a butterfly clip and pin it into place. Then you're gonna kind of French twist it. So you're gonna take a small section, wrap it over the rod, and then pick up another section. Incorporate it in and then wrap that around. Keep repeating that pattern of picking up more hair, incorporating it in the last piece, and then wrapping it further. I always make sure that when I'm picking it up, I'm not pulling it directly to the side, but I'm almost pulling it up. Once you get to the bottom, you're just gonna secure off with a scrunchie. We're gonna repeat that process to the other side. Once both sides are done, I will push up the end of the scrunchie just a little bit so that the curls don't move while I sleep. Literally look like that homegirl from Star Wars. I will just take the ends of this and wrap it around my forehead just to keep everything in place. Now I'm taking my eye cream and I'm gonna take a big glob of this. Pack it underneath my eye. This is one of my favorite eye creams. It is the Kiehl's Creamy Avocado. It works so good. A little kiss on top is this Pixi Patches. Place it right underneath my eye and once it's nice and under, I will just pat it in just to lock in the eye cream. The same to the other side. I know most people place their under eye patches the opposite way, but I saw a girl place it like this and she says it fits under her eyes so much better and I completely agree. And you're gonna take a self tanner and literally contour your face. It will make you look like you are wearing makeup as soon as you wake up in the morning. Amazing. I will just go in little layers and build this up to the depth that I want and then go to bed and when you wake up in the morning it will fully develop. Literally look so chiseled and bronze. Going in with a brow and lash serum is so key. I truly think that they work. If you don't have a lash or brow serum, I recommend using castor oil. Your lashes will be nice and long and full looking. And then you want to make sure you're getting good sleep. So I always pop in a melatonin. This is one of my favorites. It's by Ollie. It's their sleep maximum strength. Literally out like a light. We'll spray my satin pillowcases with this slumber and sleep lavender mist. Smells so good and now my mind immediately associates this scent with sleep. As soon as I spray it, I knock out. And I go in with my $5 facelift. It is literally a little chin strap that pulls up my jaw. Let's hook it over. And then... Botox hoop. Go in with my little Laneige lip sleep mask. This will have you waking up with literally the juiciest, supple, plump looking lips. And then I will pop in my night guard because I grind my teeth like a mother at night. And you don't want to be wearing down your pearly whites. So use night guards so that you can keep them nice and protected. Good night."
bellingcat-tool/amazonfinds/media/7325578681496440110.mp4,57," I know you've seen this nail glow. I cannot justify spending $100 every two weeks at the nail salon anymore. I've been seeing this everywhere. It's $5 nail glue off Amazon that is supposed to make your nails last up to 30 days. So I also bought some white French chips off Amazon. Both are linked in my storefront on my Instagram bio if you want them. Let's see if this works. Okay, here they are. They look amazing. They feel very sturdy. I will update you guys. One week later, I am genuinely shocked. I've never had a nail glue last this long. I added a top coat just for some extra protection. I think it looks a lot better top coat honestly. But I'll update you guys in two weeks, I guess but this is crazy. If this isn't enough, I don't know what is."
bellingcat-tool/amazonfinds/media/6972604311738060038.mp4,21," I cannot stop watching this video. These are reusable snap heat packs. Each pack contains a metal washer that you snap with your fingers, which causes a chemical reaction that you will see instantly begin to crystallize. They're fast acting and you can immediately feel the temperature rise to 129 degrees in no time. And they're reusable so you simply drop them in boiling water to reset them. It's an amazing eco-friendly alternative to your disposable heat pack."
bellingcat-tool/amazonfinds/media/7000887004946910470.mp4,7," Amazing music Wooo, Let's Go!"
bellingcat-tool/amazonfinds/media/6874325091459566853.mp4,33, Office mustache from Amazon. First up is this webcam cover. You can stick it right over your computer camera and slide it back and forth for privacy when you're not using it or to make sure no one can see you on Zoom. Next up is this acrylic dry erase board. It comes with a white marker to take notes and then fits perfectly on the stand to display and you just need a dry tissue to clean it. Next up is this memory foam cushion you could add to any chair. It's perfect for those who have back pain or spend a lot of time at a desk. The cooling memory foam feels amazing. Last up is this pink wireless keyboard with a built-in stand. It connects to your device with Bluetooth and you can even type directly on your phone from it without any sort of wires.
bellingcat-tool/amazonfinds/media/6953799530374614278.mp4,21," Random Amazon products you might need. I bought a magnetic hairpin holder because there's three women that live in my house. And I swear you find these things everywhere. Whether it's in the showers or they're in the sinks, guys, I find these things everywhere. Now they've got a perfect place to lay them down when they're done."
bellingcat-tool/amazonfinds/media/6902593883528547589.mp4,24," Things you didn't know you needed off of Amazon. Y'all, these magnetic twisty ties are actually insane. Each cable is made up of two magnets and a silicone band to keep all of your cords and cables tangle-free and easy to find. And if you're wondering how strong these magnets are, this one band can hold our broom off of the ground. And lastly, for larger objects, you can tie two or more of the cables together to make it even longer and more secure. How crazy."
bellingcat-tool/amazonfinds/media/7315251087664074014.mp4,191," So this is how my brother's bathroom started. I decorated it to this, but we are not done. So this is part two of decorating my brother's apartment and we are finishing this bathroom. So this apartment doesn't have much storage, so we're putting as much storage as we can. So I got one of these shelves that go over the toilet. These are my favorite type of storage because it's just so much space behind a toilet that's not being used. Like yes, you could put a picture frame there, but no. We're putting storage. So this one specifically has a tension rod, so it has like a little spring at the top. Then you just push up and push the rod all the way back and let me tell you, that thing is secure. Not even kidding, I had to use all my muscle and might just to get it in place. But once it's up, it's up and you can just put the poles however far apart you need them to be because the shelves are adjustable. It actually goes pretty wide. So if you have more room around your toilet, you can actually make the shelf probably double this size. And this one was really easy to put together. So you just screw the sides onto the pole and then if you needed to adjust the height, you can just unscrew it a little bit, move them up and down. So you just customize it to whatever you're gonna put on the shelf, if you're gonna put baskets, towels, whatever, and it looks really cool. And even better, super sturdy. This is not going anywhere. And then there's also these little clear plastic covers to put over so nothing falls through the poles. So there's way more storage here now. And then remember the door? This little hamper shelf wasn't working for the space, so we're gonna use it somewhere else. So I found something else for behind the door. This little pouch thing, you can put so much stuff in it. I don't know how much stuff my brother actually needs to store, but I'd rather put it here than have it cluttered all over the sink. And it's actually really flat against the door, so it's not bothering me when you're standing next to the door closed, so it's perfect. Now back to the toilet shelf, I found these little baskets. You can put whatever in there. And then we're gonna put towels on this shelf. So you see me stacking these all nicely and then look at him coming in and making a mess. I was like, absolutely not, thanks, but no. So after that is all organized, it looks so good. Cause like really, nobody really has towel storage in their bathroom. So this is literally perfect for that. Now time for some art. I found this cassette tape, little piece. My brother loves music, so I was like, oh, this is perfect. And we're using command strips, okay? I put it by the mirror that everybody was so upset about. Like, come on, if you want a round mirror, go buy a round mirror. My brother wanted this one. So that's what he got for his bathroom. Anyway, it looks so good. Also these, I found these on Amazon. It's a little Snoop Dogg dog and a Michael Jackson dog. I thought they were just so funny. I was kinda like, eh, I don't know if he's gonna like these, but he ended up loving them. So we are adding them in here for some pops of color. Like, come on, that's so cute. It's cute for a guy's bathroom or somebody that likes music. So those were the finishing touches. I think the pops of color look great with all of the black. Couldn't leave it looking too plain. And then his dog had to come check it out. He said, auntie, you did a good job. Adding a little flashback. So the bathroom went from this to this. Like, come on, that looks like a guy's bathroom. It's actually really nice. I liked the way it turned out. And then Reggie came to come check it out and he liked it too. He liked it so much. Watch, this is how much he liked it. He started twerking. It can't be a Jasmine and Reggie video without twerking. But y'all, bathroom is done, but we still have a lot to do with the rest of this apartment. So stay tuned for part three coming very, very soon."
bellingcat-tool/amazonfinds/media/6835774856068336902.mp4,40, best one yet things you didn't know you needed off amazon part 18. alright this is our ice cream ball we found off amazon and it makes homemade ice cream in 10 minutes. so we've already mixed up the ice cream mixture and we're gonna pour it into this end of the ball and screw on the top. alright on this end we're gonna fill it with salt and ice and a bunch of rock salt. alright we just put on both ends and now we're gonna kick it around for about 10 minutes and wait for the mixture to freeze. let's see oh my gosh yum
bellingcat-tool/amazonfinds/media/7240531375915371802.mp4,40," Five Amazon travel products you need. This is the world's smallest portable charger. It's even got a little screen to show how much charge it has. It's also really light, so great for putting in your pockets or in a bag. This is a tiny toothbrush with a toothpaste capsule built in. It also has a toothpick on the other end. They're great for using on flights. This bottle can carry four different liquids in. Just fill each one up with, for example, shampoo. Then just twist to the correct one and push the button to dispense. This travel bottle holds up to 500 millilitres of liquid. It's got a clip to attach to bag or trousers and collapses to take anywhere. This little buddy holds your favourite cologne or perfume in a tiny bottle. It's a great size and it holds the perfect amount so you don't have to take the whole bottle with you. And this is dissolvable soap with just thinner than paper. They come in a tiny pack so you can take them anywhere with you so you can always keep your hands clean."
bellingcat-tool/amazonfinds/media/7354668274417798433.mp4,0, What is important to you? What is important to you? What is important to you?
bellingcat-tool/amazonfinds/media/7068077104621194543.mp4,19," Random Amazon finds you just might need. This is one of my favorite kitchen items that will keep bread fresh and makes it easy to dispense one slice at a time. Just grab your bag of sliced bread, drop it in, pull the edge of the wrapper around the outside and to dispense, pull down the wrapper and the bread pops right up. This thing is great to protect and preserve your bread and you can keep it on your counter or in the pantry."
bellingcat-tool/amazonfinds/media/7092120912236956971.mp4,11," It's about their time In a minute, I'ma need a sentimental man or woman to pump me up Feeling fussy, walking in my Valencia seats Tryna break out the fabulous Cause I-"
bellingcat-tool/amazonfinds/media/6928521417579400454.mp4,25," Amazon tech gadgets you didn't know you needed. This iPad case comes with a detachable Bluetooth keyboard that sticks to the case magnetically and you can change the backlight color of the keys to any color of your choice or let it rotate automatically. It has a nifty little spot here for your Apple pencil and can connect through Bluetooth to your iPad, Android, iPhone, or notebook. The case is also shock absorbent and has a heat release air cooling effect so you don't have to worry about your device overheating anymore."
bellingcat-tool/amazonfinds/media/6933027041927286022.mp4,27, products you need or don't this is part 214 of 365. Anyone else have this problem? Your outlet adapter is supposed to power six devices but you put in a few of your plugs and the other outlets can no longer be used. Introducing this three sided outlet extender from Amazon. It has search protection to ooze ports so you can power all of your devices no matter how big or wide the plugs are and as a bonus the outlet adapter has a nightlight as well. So what do you think? Is this a useful find or not?
bellingcat-tool/amazonfinds/media/7321896649868004651.mp4,43, LALALoddus I'm a I'm a I'm a I'm a I'm a I'm a I'm a
bellingcat-tool/amazonfinds/media/6951790693962484998.mp4,9," What's up? You know we finally here, right? What are we? It's Friday then it's Saturday Sunday"
bellingcat-tool/amazonfinds/media/7278806441798962474.mp4,67," As I am saying, I hope you will continue to see the kids at school who will be able to take a more rapid journey in the morning. So, come to this container in Walmart and find on the Internet these papers with the days of the week. The court and then the book in the book to open it so that it can be more time-consuming. My wife has the machine at the door and she goes to the door. I hope that the day of the week will open up because I will be able to take the container. So, I am here, I am pointing to the kids. I will be looking for them. I will be pointing to the days that go to school. In the last few days, to get the rope of the activities of my children, in every container there will be a book, a pencil, a book, and a book. Also, the temperature for the week and I will put a sweater for the days that are more free and I will take the rope of the activities of the week. Now, when the day comes, I don't have to be looking for them because they are all listed. Stay safe in the court. What do you expect?"
bellingcat-tool/amazonfinds/media/7258978731979509019.mp4,0, 🎵Music🎵 🎵Music🎵
bellingcat-tool/amazonfinds/media/7087030525096906026.mp4,10, There is no right way
bellingcat-tool/amazonfinds/media/7186081054766222635.mp4,50," Why are you so extra? This is so unnecessary. You live in an apartment. Why are you doing the absolute most? Do you have OCD? You clean too much. You need to chill. Ignore it friend. I do. Keep living your best homebody pampered princess life. And no, it doesn't require a lot of money. When I come back home from the streets of this crazy world, I'm not ashamed to say I'm coming home to my little piece of heaven on earth. I love creating a space me and my family can enjoy. And there ain't nothing better than a space that brings peace and tranquility. Remember, self-care is filling up the cup you pour from. Like and follow for more."
bellingcat-tool/amazonfinds/media/7176477853884648746.mp4,58, A courtside stretch look at the hi All
bellingcat-tool/amazonfinds/media/7079413746388454702.mp4,59," I didn't see this video, check how I want to roast it Utilizing this bread, oh my god, I thought it would be a filter Incredible, I love it Here I have the best of all the bread that comes in 4 different packages and different economies These are the ones that come in Amazon, Aligual, Kala Chica and Costa Roms in 2019 So I don't need more and we're done I don't want to eat It comes in a different package and all and check I feel super so busy I can't see how I have the Chica now, let's see Let's see Let's see What do you think? It's so... I don't like the bread because of the rice and the bread Cí unw Madame"
bellingcat-tool/amazonfinds/media/7358572117429980462.mp4,46," This is a three-piece ice mold for your Stanley. But you're supposed to be able to stack the ice layers to maximize the coolness factor. But you guys know how much I hate single-use products. Why have regular ice when I can make spa-flavored ice? And then it even comes with this storage thing, which I probably should have put it in there first. It's the next day. Nice and frozen. A little spillage from the water. I guess you can just pop it out, or so I thought. So we drop this guy in at the bottom, and then this guy next. Whoa. Well, that one must be for the 40 ounce, the 30 ounce ice globe is much better. I want to see if this fits into a regular size. Oh, it does. Actually though, that makes it kind of pretty. And then you don't have like ice cubes sloshing around. I'm gonna use this ice maker. An eight out of 10."
bellingcat-tool/amazonfinds/media/7183422055055101230.mp4,47, I'm going to put the butter in. I'm going to put the butter in. I'm going to put the butter in. I'm going to put the butter in. I'm going to put the butter in. I'm going to put the butter in. I'm going to put the butter in. I'm going to put the butter in. I'm going to put the butter in. I'm going to put the butter in. I'm going to put the butter in. I'm going to put the butter in. I'm going to put the butter in. I'm going to put the butter in.
bellingcat-tool/amazonfinds/media/6809065992610745606.mp4,43, I have really oily skin so I'm gonna try this new Revlon oil control on the go stick. It's made out of real volcanic stone and it's like a roller and you roll it on your face and it's supposed to take away your oil. You guys can see that I am oily AF. So let's just roll it and see what it does. Wait but look at this. Yo what the heck. It literally gets rid of all the shine and it doesn't mess with your makeup at all. What the heck. This thing is crazy. Obsessed wow.
bellingcat-tool/amazonfinds/media/7145528073738308910.mp4,59, Thanks for watching.
bellingcat-tool/amazonfinds/media/7196691872121720107.mp4,11," Um, life is good though. I want y'all to see that life is great. Your life is great too. Have a good time, man. Have some fun."
bellingcat-tool/amazonfinds/media/6947051048850705669.mp4,22, Random Amazon Car Finds
bellingcat-tool/amazonfinds/media/7045316315023887663.mp4,52," My whole family pitched in to buy over 100 unclaimed Amazon packages for our family Christmas. These are some of the things we got. The holiday is the holly that will be on your own. Front door, a pair of hop-a-long boots and a pistol that shows you the wish of Barney and Ben. Jaws that will talk and we'll go for a walk is the hope for Janice and Jen. And mom and dad can hardly wait for school to start again."
bellingcat-tool/amazonfinds/media/7314858831375273262.mp4,61," This is my Mova globe and the cool thing about it is it uses light and Earth's magnetic field to constantly rotate by itself But there's two problems with it It's only four and a half inches which is too small and when it gets to be nighttime It's instantly inaccurate because this shows the globe during the day Well, I just got something that solves both of those problems. I actually haven't opened this yet So, I don't know what it looks like. I'm gonna let you guys get the first look Oh, so this is the base for it, but ah and then the moment of truth hopefully ah the Earth at night Mova globe that looks so Insane so of course, it's a Mova globe. It has some weird properties to it It feels like you're holding the real earth. How can you not like that? That is so sick My star fell down stay. Alright, let's complete the look there. She is that looks insane"
bellingcat-tool/amazonfinds/media/7227490640945384750.mp4,11, I'll see you guys next time.
bellingcat-tool/amazonfinds/media/6869932627319590150.mp4,21," rating things celebrities have influenced me to buy. The Kardashians favorite blanket. Disclaimer, I am incredibly easily influenced. And I also love Kim Kardashian. Anyway, so the Kardashians are obsessed with Barefoot Dream. You don't know about it. It's these special blankets, like really obsessed. So I was like, okay, what the fuck is the deal with this blanket? So I look it up and it's $180. I was like, uh, does this blanket come with a Prius? The angel Gabriel himself knit this thing? But Kim loves it and I love Kim. And I'm an enormous sucker, so I got it. Let me tell you, not only would I pay them another $180, I would give them my car, my firstborn. The blanket is life-changing. Feels like Peach Fuzz and Cashmere did a collaboration. Say what you must about Kim. The girl knows her shit."
bellingcat-tool/amazonfinds/media/7259505958118853931.mp4,65, Top 15 Amazon products for this month. This is a human-sized dog bed that comes with its own blanket and it's machine washable so it's easy to clean. This is a trolley dolly which makes it easy to roll heavy items up the stairs. This is a smart trash can that automatically seals the bag when it's full and when it's done it replaces the bag by itself. This is a latte pen that lets you draw meaningful designs on any type of drink. This sign sticks on any type of car window and allows you to communicate with other drivers on the road. This is a fake rock with a secret compartment where you can hide your house keys so no one can find them. These are disposable air fireplace. You never have to wash the inside of your air fryer ever again. This pot can plug into an outlet so you can cook any type of food from your bed. These are mess-free nail clippers. They store the clippings inside a compartment so they're easy to throw out. This is a Bluetooth scroller that lets you swipe through TikToks without even touching your phone. These are reusable straws that come apart when it's time to clean them and once you're done you can connect it back together. This is a car mirror that snaps onto your existing one and it lets you see both of your blind spots. This is a sapoon which has a notch on the side of it so you don't get your counter dirty when you set it down. This is a sink topper which gives you more counter space in your bathroom which is perfect for small apartments. This is a wireless water dispenser that you put by your bed. It lets you choose the amount of water and then it fills up automatically.
